USER COMMENTS,Tags
gets to complicated or confusing with all the dropdowns and choices. I don't use 80% what what's there and never will. also the program has a tendency of dropping out or closing while in the middle of work (timing out). ,Performance Issue
It freezes sometimes which makes creating work orders for clients harder. especially if we are in the middle of creating it and we'd have to re-do everything,Performance Issue
"WE need to get more training to our customer on how to submit work order through Service Insight. I am showing a lot of customer how to use it. Plus the one that are submitting work orders, they are over the spectra and I spend time to correct them, so we a get a true count on issues we are working on.",Performance Issue
"The display boxes in the PM jobs screen, are just small enough to be maddening. There is room on the screen for larger boxes, so you can see all of the details in the PM job boxes that display the PM jobs without having to scroll a half inch, but this room isn't utilized. Also, when checking the Cycle Statuses in the PM jobs, only the work order(s) for one cycle show in the data results list below, even if more than one cycle ran for the time frame indicated - you have to use a drop down for the Cycle Instance field to see all of the cycles that ran during the time frame. It would be very helpful to see ALL work orders that ran during the time frame indicated/selected. ",Performance Issue
Not very robust nor intuitive interface. Personally I   would like ( among other things ) better print options so that one can print out task lists/ procedures etc into hardcopy instead of being fully limited to referring back to electronic device all the time.,Performance Issue
"I would like to be able to use SI7 as a financial tracking tool, but currently unable which makes inefficient use of my time. ",Performance Issue
"Overall Service Insight is user friendly and intuitive. My main complaint is the fact I have to refresh it every 5 minutes in order for the QuickList to stay active. Or, if I am working on something, exit and come back, it appears to be 'active' when the second you hit something it has to refresh. It would be better to just time out completely and return to the log in screen if it can't stay actively running, so at least you don't falsely believe your info is active and correct when it's not. ",Performance Issue
"Sometimes the platform as such has speed problems or integration with other platforms, for example: MyBuy, generation of emails or notifications, it is slow to load files",Performance Issue
I can be more interactive and user friendly. ,Performance Issue
Lag to run reports or Lag in general when entering work orders. Timing out of the system with no warning or notification,Performance Issue
"Navigation is brutal.  Toggling back a screen is awful and you have to start completely over again.  Ex: Site history - list populates - dive into WO, back out and have to re-enter parameters again, instead of going to the previous screen",Performance Issue
"Maybe is lack of training, but there are certain tools that I'm still have difficult to use or understand.",Performance Issue
MFM  needs a total overhall. ,Performance Issue
"Some of the sub-categories are not obvious, such as ""other services"", etc. when trying to find the issue you're trying to address.  Meeting room set-up should be easy to find, etc.",Performance Issue
se podri­a tener una opcion para cambiar de estado las WO PM en vez de cambiar de a una  por lo demas muy buena app,Performance Issue
"The report process is lengthy and after putting all the settings right, it still doesn't generate reports ",Performance Issue
"SI has a lot of bugs still, even after the crash and update. Need to work on being better and user friendly.",Performance Issue
Actually my dismay is with IMFM. It has continued issues.,Performance Issue
"The only complaint I have is that I have to close orders on my mobile device, It would be so much easier to do all from desktop or if we have a windows based Ipad or notebook",Performance Issue
"it could be a little more specific for what we do.   Say, we have jail security network which includes card reader system as a sub system to the computerized access system.  And Si7 only have card reader system... ",Performance Issue
ServiceInsight is very easy to use but sometimes the SI is very slow and takes to much time to create a work order,Performance Issue
Perhaps more access for techs. ,Performance Issue
Need full access in little menu in App for evolve the tickets.  For be react to the client,Performance Issue
"If you had some videos that showed how to use it, it would be better. I'm a new user and I'm having to self-teach.",Performance Issue
"For me on my desktop is working well, but for the CBRE technicians.  They experience many problems went the systems freezes a lot.",Performance Issue
cheat sheet for clients on how to enter a work order and use the correct codes.  Educate vendors and clients on SI7 and have them add all pertinent documentation into the work order for a more streamline process ,Performance Issue
It's a good CMMS and easy to use,Performance Issue
A more user friendly interface would be ideal. ,Performance Issue
"The date range is American, it would be helpful if this is English. ",Performance Issue
There should be a survey when the ticket gets closed out to rate the performance of the work.,Performance Issue
"In the labor hours pop-up, the ""Completed"" box should be a check box that can be unchecked.  Currently if you click the box, you have to close the window and reopen it to uncheck it.  ",Performance Issue
there need to be more resolution codes to add a work order to. Like hanging a picture. there is no resolution code for that. ,Performance Issue
None,Performance Issue
I'm not a fan of the traffic light on the laptop. to me the laptop is too complicated! ,Performance Issue
"It works ok, sometimes it crashes repeatedly or doesn't save selections.",Performance Issue
The only issue I have with Service Insight is that not enough Vendors are using the VAWS portal to update their WO's. If they would do that then the system works well.,Performance Issue
Make the Moble app more user friendly. You dealing with engineers that would rather fill out a paper form than SI7. Look at other apps like Hotsos or Tech Anywhere. Both systems are easy to use for the technician. I have engineer's that spend way too much time in-front of the computer filling out the JSA's that should be a simple yes or no multiple choice question. Hire the personnel that created those great easy to use systems and completely restructure SI7 with input from the techs in the field as appears to the personnel that sit at a desk pulling reports. You have made there jobs easy please make ours simpler!,Performance Issue
IT keeps kicking you out of the IMFM and you constantly have to sign a many times though out the day.  Say for example I want to see my pm work orders.  I have to scroll down to a building and click on a building's pms.   I click on a pm and then close it.  Now I have to go all the way back to the beginning of scrolling down to the building again and click on it to get my next pm for the same building.  Ugghhh. ,Performance Issue
There are just too many improvements to list needed for SI in this small box.  * Database needs cleaned up and logically aligned to the field names on the front end UI ,Performance Issue
"Si7 slows considerably during peak times, when I use Si7 in the off hours I notice it is much faster to navigate. Thank you.",Performance Issue
System is slow ,Performance Issue
Less Glitchy,Performance Issue
not at the moment,Performance Issue
It would be helpful to receive an email notice when vendors add quotes and updates to the work orders. There are way too many work orders we have to manage and cannot go in each to check for updates.,Performance Issue
have faster and more intuitive access,Performance Issue
you may perform more friendly commands ,Performance Issue
"Make it more stable. I have used work order management software for over twenty years with different companies. This is the worst one I've ever used. It crashes multiple times a day, often doesn't respond to what I tell it to do, and has options for the desktop version that aren't available in the mobile version, and vice versa. It's awful. The last company I worked at had about thirty employees, and the work order software was better than this. Do better!",Performance Issue
Improve on downtime ,Performance Issue
"ServiceInsight, It is a platform designed for maintenance.  The day this platform can be integrated into COUPA will be when it has an integrated supply chain model with more than one module and not only focused on maintenance.",Performance Issue
"It would be nice if it were simplified to ad correct information to equipment P.M's. On SI7. I'm the boots on the ground and I see ways that we can work more efficiently and easier. My jobs start for me on SI7 and we can do small changes that will increase our efficiency, time, and money.",Performance Issue
Have better platform support ,Performance Issue
The system is not a one size fits all. Fairly useless in a leased site where the building has its own work order system versus an owned site which uses Service Insight exclusively. ,Performance Issue
"There are so many different platforms that we have to use now - RAD, Harbour, elogbooks, , Si7. But none of them talk to each other! Si7 is ideally placed to be a one stop shop, i can't believe it is not already the case. When a ticket is assigned, in particular reactive tickets, at the very least we should have an option to complete a DRA specific to that task, that is now attached to that ticket.  Also, searching for a specific closed ticket is a nightmare, unless you actually know what that Si7 no. is.",Performance Issue
Looking up previsous work order not easy. Location are not all in alphabetical orde. Many location are inncorrect  User are not directly involue with updates,Performance Issue
There should be some video tutorials embedded in applications for engineers to know more about applications. Self-help articles should be easy to go.,Performance Issue
I would like to request to have a live training for all users as a brush up training where we can ask any queries we are facing.,Performance Issue
Not able to see previous raised & closed tickets in the tool...Kindly improve to see all the tickets.,Performance Issue
Is it possible to share the report automatically on a weekly basis? where the team is required to take action.,Performance Issue
I think a more intuitive and user friendly app/platform would help both technicians and tech coordinators work with this tool,Performance Issue
"Amfm is the worst app I have ever had the displeasure of using. It constantly freezes, logs me out, runs slowly and throws fault codes. I constantly have to clear the cache to perform basic functions. I have a long list of faults logged with IT. Get a functional app.",Performance Issue
"Currently ,all the Service request can be view only on Desktop , in case Duty Engineer is on walk rounds or doing any activity and if any critical ticket is being raised , then he will not be notified on Realtime basis , No text message is being trigged.",Performance Issue
"Honestly no since I understand the level of security that must be provided on accounts like this, multiple levels of verification have to be taken. It's easy for me,  but no so with a non computer literate person.",Performance Issue
.MFM needs a lot of work. It doesn't handle changing connectivity well. Times out and doesn't tell you. ,Performance Issue
No,Performance Issue
Sometimes it's not really intuitive and a bit slow and clunky (specially the web version). ,Performance Issue
Not at this time.,Performance Issue
No,Performance Issue
Would be easie if sub orders were a link you could click on rather then having to search the number. Would make the process a lot easier.,Performance Issue
I would like to see a skin that doesn't look like it's from the 1980s and ,Performance Issue
"*wish I wouldn't have to enter the Password everytime I login on the mobile app.  *The mobile app times out during doing live work orders, it ends up having to close out and restart during the process of doing a live work order.  ",Performance Issue
"it could improve to be better than today. It is interesting if we can have the opportunity for modify the status. In the other company, the sftw has lot of more intuictive status.  WAPPR Waiting approval (actual OPEN) PDO Offer send and waiting approval WMATL Waiting material COMP Complited (and waiting to realize the contability) INPRG In progress CLOSE Complited/Complited and billed",Performance Issue
No comments,Performance Issue
The portal goes down often and client cannot input service requests because of this.,Performance Issue
"I believe it would be useful to have more team member involvement in organizing how we use the system and adding more detail so it provides a more robust history of assets, for use of the engineering team as well as management.",Performance Issue
"My recommendation is that the service is not very friendly. Every day or every 2 days if you not login you have to reset the password, it`s really frustrated in this matter. It is not easy at all. I choose not to login every day. ",Performance Issue
Service Insight needs more capability to view more than 8-10 rows at a time.  The constant need to export to Excel makes using this tool clumsy.,Performance Issue
 We recieve our work orders this way. All the team say its too complicated as in there is too much info tabs. Yes there usefully for say manager or supervisors. We just need a tab to open a job list then click on that and deal with what the job entails. ,Performance Issue
"I use this as our work order system. There are important things that are hidden in spots that you wouldn't look. For example, reporting vendor escort, training hours, admin time, meeting time and other types of time used for things other than work orders. ",Performance Issue
"Not at this time.  Currently, I just use ServiceInsight in a limited capacity when assigning technicians from FMO FXE work orders or reassigning them.  And looking up their contact information through it.",Performance Issue
Not got thu Uset,Performance Issue
"Sinceramente, desconozco el uso de esta herramienta con ese nombre. En la actualidad gestionamos varios clientes y no sabemos cuanto sistemas usamos.",Performance Issue
Great help for my job. ,Performance Issue
Quite happy on how this system works,Performance Issue
There is a field that our account can't use because it has been misused for another account. I don't think it's fair to us. We could use this specific field for its original use and it would benefit our efficientcy. Other point - The performance is sometimes VERY slow so efficientcy is not a thing then. ,Performance Issue
More user friendly interface and innovative look and feel,Performance Issue
Service Insight for CBRE users are very outdated. ,Performance Issue
Insight tends to kick the user out too soon (approx 10-15 minutes) whether actively using or not. Quite frustrating.  ,Performance Issue
"it can be slow to respond , which becomes frustrating when completing quality checks, which is a repeat activity , ",Performance Issue
Can be difficult to navigate ,Performance Issue
"I would like to have more options available on the FM Dashboard, allowing me to view all the work orders that correspond to my role as an FM. At the very least, it would be beneficial to have the option for customization, enabling me to choose what I want to see.",Performance Issue
The frequencies of the PM ID's need to be adjusted ASAP! After 9 MONTHS this is still not done!!!,Performance Issue
No idea,Performance Issue
Mfm app would be great if you could upload more than one doc/pic at a time ,Performance Issue
"FR: laisser la possibilit√© de mettre un ""Probl√®me code"", sans √™tre oblig√© de choisir un existant, car ceux-ci sont incomplet, ex: Relamping inexistant dans la liste, Idem pour les lieux, ex: R+1 (OK) mais dans le sous-menu, existe uniquement sanitaire, alors comment cr√©er une demande pour les Bureaux, couloir du R+1 ou Escalier?   Quelques am√©liorations seraient utiles, ou bien lass√© l'opportunit√© au Technicien de mettre lui-m√™me les infos dont ils a besoin.  dans les onglets, ou les choix sont pr√©d√©termin√©s, afficher le menu d√©roulant, afin d'avoir la visibilit√© de tous les mots cl√©s pr√©enregistr√©s, afin de choisir le plus pertinent.    une r√©el version FR serait appr√©ciables, afin d'√©viter les erreurs de Traduction.",Performance Issue
Some jobs currently do not dispatch due to an ERP code. ,Performance Issue
Training very difficult and very unclear to use the platform. ,Performance Issue
Most of my work with ServiceInsight is deploying it to new clients and assisting them in understanding the benefits f the tool. I am not a regular user although I am a certified user,Performance Issue
Better training to use servceInsight ,Performance Issue
Very slow when you open multiple WO in parallel ,Performance Issue
"Yes as a new starter i need training on this important tool ,is their a training g package for new starters to use. As it is the main maintenance system its vital its used to its full capacity . Please use me as a student as i need to lean it 100%  thanks for the chance to reply  ",Performance Issue
"this is an old system, confusing and not easy to use at all, ",Performance Issue
When I ask for work orders to be reassigned they sometimes get reassigned to me instead of where I request it be reassigned too.,Performance Issue
Field po creation process wo number should not be needed I'm in wo allredy,Performance Issue
"I would like to have training documents or partner with someone who provides training on SI7 - There is no one we can go to when we are not sure how to do something in the system, no internal support team. ",Performance Issue
"The mobile app is constantly logging you out, even when you have started a work order. ","Performance Issue,Business Process Doesn't Match"
ServiceInsight is too much complicated for small or very small sites.,"Performance Issue,Data Issue"
"When you have it open and have to leave and come back it log you off, some days it all the time and other it does not log off at all. Looking for consistence. ","Performance Issue,Data Issue"
"the interface is difficult and not intuitive, ","Performance Issue,Data Issue"
"I have experience with several work order systems.  I am new to this system and find it to be more challenging than some and less challenging than others.  So far, WorkDay is the best system I have experience with.","Performance Issue,Data Issue"
"I feel that there should be little reason to speak to the person requesting service. But, there always is a problem of incomplete descriptions or locations or other details that are not listed on the service request. Tracking people down to get details makes my job more difficult than necessary.","Performance Issue,Data Issue"
Sometimes the interaction is hard. Per example when it's needed to change the request and/or define some codes.,"Performance Issue,Data Issue"
"It doesn't seem like we spend enough money on upgrading SI to ensure the best experience for our customers. Internally it is not even that important, but our customers shouldn't speak negatively about the way the interaction with the system is. The feedback we get from them is that the app is too cumbersome, the application experience is just not good enough from customer's standpoint. I know Jarvis is being piloted, but we are not moving fast enough with the upgrades that the system needs. In addition, we need to come up with an app that will allow us to collect and upload assets into SI without having to do it more than once. Asset Insight and capital planning tools should also be integrated better into SI.","Performance Issue,Data Issue"
"AS a technician when I bring up the work request in the timecard many details of the work request are not carried over, I then have to go back to 1) My work orders, and 2) the email that was sent that I was assigned a work order. Very time consuming. ","Performance Issue,Data Issue"
Search queries are complex.  There are a lot of steps which must be considered when pulling historical information.  ,"Performance Issue,Data Issue,Usability Issue"
None.,"Performance Issue,Data Issue,Usability Issue"
We really need a feedback system more intuitive and user-friendly. ,"Performance Issue,Feature Request/Enhancement"
"Searching for assets is complicated, there doesn't seem to be a good way to search for assets at one particular site.  Likewise, searching  for work orders is difficult.","Performance Issue,Other Issue"
"one thing that would help me is, looking at my work orders for the day through the timecard option is a hassle,  would be nice to have a simple way to see my time for the day in an easy function. ","Performance Issue,Other Issue"
Test fully on mobile devices - some functions are great on desktop but fail in the field with a mobile pda.,"Performance Issue,Other Issue,Training Needed"
Stop it from crashing and having to log in 20 times a day and speed it up so it doesn't take 5 minutes to load,"Performance Issue,Positive Feedback"
None,"Performance Issue,Technical Issue"
"I need more administrative control to revise or add assets, assign auto generations to specific technicians as needed, and make misc. changes as needed.  ","Performance Issue,Technical Issue"
functions from other work order systems are not present cannot put work on hold for parts or reschedules not much useful function at this time,"Performance Issue,Technical Issue"
"Specifically a great improvement can be the push up notifications for the mobile version, this can help avoid due after hour Due WOs. ","Performance Issue,Technical Issue"
Entering work orders is very time consuming as some portions of the process are very slow.,"Performance Issue,Technical Issue"
"Allowing more active functions, like submitting field PO's, after starting a work order. ","Performance Issue,Technical Issue"
"It would be great if the FM could choose the priority and timing line of work order. FM knows best how long it can take, and sometimes it is very difficult to fit in the timeframe given and cannot be changed so easily. ","Performance Issue,Technical Issue"
Im Dissatisfied because we dont have all the assets of Coca-Cola in the system so is difficult to oversee if everything is doing right,"Performance Issue,Technical Issue"
An improvement opportunity- allow multiple unit entries in one labor window session,"Performance Issue,Technical Issue"
"Just a little bit confusing the child WO, for the rest very easy to use and work with it.","Performance Issue,Technical Issue"
Is need completion date request on the front side so we don't have to enter the wo to find out. ,"Performance Issue,Technical Issue"
A lot of outages occur,"Performance Issue,Technical Issue"
"As CMMS tools go Service Insight is below average.  It is cumbersome to use and not very intuitive. I typically utilize support teams to help create the WOs and then I close them.    I see that on other accounts we use Corrigo this is much better system with more functionality and support.  It has allows for asset management, payment tracking etc.  ","Performance Issue,Technical Issue"
"With respect to problem codes, it would be useful if we had the option of identifying a request as 'capital'...often we are driving capital jobs from Si7 and the ability to pull reporting, especially for financial aspects would be very useful from an FM perspective. ","Performance Issue,Technical Issue"
Less computer lingo in the menus. Gear it more towards everyday users not familiar with lingo.,"Performance Issue,Technical Issue"
At times the system seems to be clunky or slow when using the system. Updates to PMs or work seem to not stick when updated and causes a lot of confusion with the admins and myself in duplicate work and updates to locations etc.,"Performance Issue,Technical Issue"
"It's very slow, creating a ticket, searching for a work order, generating a report are tasks that are very time consuming, with either too many steps or loading times are higher than normal.","Performance Issue,Technical Issue"
nothing I can think of at this time,"Performance Issue,Technical Issue"
Not sure.,"Performance Issue,Technical Issue"
Definitively we need the tool and it does much of our daily job.    My feedback is that:  1. The tool needs a major upgrade with many and new modern features that graphics and colors that may please the user's eye. ,"Performance Issue,Technical Issue"
No comments ,"Performance Issue,Technical Issue"
Make it more streamlined less is more,"Performance Issue,Technical Issue"
"1) All WO's should be raised from a common screen. Now sub-orders of a Master WO are raised by accessing the Master WO eg E WO's. Whereas, C WO's are raised via the Call Entry page. ","Performance Issue,Technical Issue"
None,"Performance Issue,Technical Issue"
"It is difficult to define parameters and run reports. For example, to find a certain PM for all locations or to find all corrective and project work orders (excluding PM's) for one location. ","Performance Issue,Technical Issue"
Best Tool.,"Performance Issue,Technical Issue"
"It's too ""clumsy"". It's slow loading all the open ( like 20 tickets). ","Performance Issue,Technical Issue"
