USER COMMENTS,Tags
"it would be nice to receive ""training"" on the SI7 to better understand what all it has to offer. Everything I know on the SI7 app is what I learned by trial and error.  very little training was offered to me when I came back to CBRE almost 4 years ago.  We have had one training day on Teams with Ms. Frenetta Tate.  I, along with several others of my team, have had little class training time on this app.  I probably could be doing something in an easier fashion if I only knew the system better.  I typically use my phone app to complete most of my work on SI7.  I'm not comfortable or understand SI7 enough to",Training Needed
"The IMFM format works better for entering work orders, but lacks the flexibility and control that SI7 has in the desktop format",n/a
maybe add in some more problem code or equipment group categories to list,Feature Request/Enhancement
"I think the usability must be easier. SI7 presents some troubles when we change languages, for example.",Usability Issue
"I think SI7 is outdated i.e. the layout, the colours, etc. I would be grateful if the 'change category' box can be eliminated from popping up every time a request is opened.","Usability Issue, Usability Issue"
"I use SI7 for the majority of my CBRE work, as it gives me more flexibility and visibility on which vendors are actually being dispatched to. With the huge dispatch matrixes for all of the services, it's almost impossible to keep track of which does what and who is primary and secondary and tertiary and who has a tech to make ServiceInsight very useful.   ",Positive Feedback
"takes time to open and navigate through and WOs, assigning WOs need to be done individually which sometime it is time consuming need some flexibility especially in search tools, it is not user friendly when need to look for assets and PMs ",Usability Issue
PM reporting could be better; missing the option to store building details at the building level with ease of access/reporting of those items,"Data Issue, Usability Issue"
"Cost code selection is slow, and will erase input if done before the cost code has time to load - No Popup to show when session has become inactive - Login screen is unsecure (for me to 'log in' is to just delete the section of the url 'https://sso.mainstreamsasp.com/PRD00177CFG/log in' "" - After creating a WO, if creating a second one, and switching back to the first, the title will duplicate to the other one, and affect both (or all if more then 2). This causes confusion for the vendor.  If you want to see these issues, I can show you. Email: [email].","Performance Issue, Technical Issue"
A little vague on the meaning and purpose of this service ,n/a
"Lack of consistency with keeping conductivity. It Can lack user friendly features from time to time when it comes to communicating with other vendors attached to VAWS. It gives you an option to email outside attributes but doesn't always seem to deliver messages sent. There should be a more direct communication string that lets you see important messages sent back from the vendor or that you send to them that get directed to the recipient except through an email a message attached to the work order when it's closed. Also, the client needs to have a better understanding, at times, with what work gets sent to maintenance requests and other tasks outside of our scope ",Feature Request/Enhancement
I think if you had some training videos that will show us how to navigate through the site that would be perfect.  ,Training Needed
"The report process is lengthy and after putting all the settings right, it still doesn't generate reports ","Usability Issue, Performance Issue"
it would be great to get an app for the phone that works as good as the computer version. thanks Myron,Feature Request/Enhancement
"UI overhaul focus on lessening the amount of ""Clicks"" required to achieve an outcome.",Usability Issue
"The tools is not friendly user.  It has archaic graphics, complicated search tool,  hard to find what we need.  Many times my team and I want to update a WO and we end asking for help in our organization because the tool does not provide the right access we need.    We are not allowed to integrate new PM schedules and always depend on others, but the response time is always more than a month.  Our productivity has depleted with this tool and the client prefer not to use it, since they never can't allocate their WO in the right field.","Access/Availability Issue, Usability Issue"
Be able to view a password when entered into the login page.  This would be huge and potentially cute down on password resets.,Feature Request/Enhancement
improve reporting,Feature Request/Enhancement
"Constantly getting kicked out of the mobile app makes things problematic, especially if someone else puts time on that work order. I have been locked out for weeks in the past because of this issue. The location being placed before the unit information is an issue. I think it should be, unit (by clients unit number), location, site, then bookkeeping or some whatever stuff. On the back end, we need the date in, date due, unit, who put the work order in, and the problem. The site information can come later. People usually know at what site they are working.",Performance Issue
The preventive maintenance is not friendly. Also is needed in local language and with local job plans and frequencies.,Usability Issue
"Systems take long to load or refresh . Often kick out , Hard to find the vendor or a category of jobs .   If you want to know what kind of tools could beat SI7 , look at Monday app . This is very user friendly and efficient ",Performance Issue
"Small quality of life changes. Less of a need to constantly sync, and more streamlined menus in IMFM.",Integration with other Tools Needed
"When viewing the Quick List, regardless of how many WO lines a user applies in the system (I have it set to 75 lines), only 9 are visible, because of the fixed letter box style panel they are listed in. If this was expanded so that more were visible, making better use of the browser window available, WOs would be much easier to find when scrolling up and down the list.  WOs that have been closed have their status changed to ""posted"" after a period of time. It is not possible to link new WOs to posted WOs as related. This would be useful, as relating tickets builds a knowledge base over time.","Usability Issue, Feature Request/Enhancement"
Frequently experienced connectivity issues ,Performance Issue
Very User Friendly program,Positive Feedback
"make it mandatory to have problem description along with problem location and other key details, before someone can submit a work order. make it have more steps to complete a work order so people who need the info get it an those who don't give enough will start correctly filling the request out ",Usability Issue
A number of the processes require numerous steps to confirm an action and to clear the actions acknowledgment.  NTE uplift is totally illogical   These problems may be driven by user approval levels.,Business Process Needs to Change
none,n/a
The system is not very intuitive. ,Positive Feedback
self generating work orders are over complicated being that you have to put your information in several times instead of a quick problem/ solution work order with labor time. Asset management isnt very user friendly for finding equipment or past work orders. ,Usability Issue
Wish lists.  Site IDs on the work order would help. Not receiving a  email when I reassign a work order. It just fills my in box.,Technical Issue
"SI could be improved with more functionality. If we didn't have Coupa and could do everything in SI, it would help. PO's are time consuming, price increase or decrease takes time. One stop shop would be so helpful.",Performance Issue
Provide user friendly instruction/guide for information needed/how to fill out a req. ,Usability Issue
Everything looks to be working out fine.,Positive Feedback
The only issue I have consistently is with login to the mobile app.  I usually have to try multiple times to login successfully. ,Performance Issue
"Not for me, but for contractors I do business with. They need more help navigating the system/portal.",Usability Issue
not at this time,n/a
"Integrate the NTE feature in SI with financial software, like JDE. Additionally, when a global vendor is added into SI in one country, the Global Strategic Sourcing team should ensure the vendor is populated in all applicable countries so that CBRE Clients can take advantage of this value add service model.",Integration with other Tools Needed
On the top of every page. If there could be a field in which you can type in a workorder number for quick search access. Sometimes im on the phone and have to type in the workorder number the client is telling me. Be say I have just done a site history search - now I have to find the drop down to get to workorder history and then type in the workorder number instead of just being able to search the workorder number from my original page. The home page/ opening page should also have this feature so I can dive into workorders as soon as i log in. ,Feature Request/Enhancement
It should be translated into different languages. I'm from the LATAM region and my native language is Spanish. I would prefer to use it in Spanish and so my team.,Feature Request/Enhancement
Printing reports does not always work for what I need,Performance Issue
SI7 and Coupa need to be integrated. Once a WO is dispatched to a vendor the WO is basically useless and becomes a record. Running any kind of cost analysis report has to be done separately because you can't pull in labor (CBRE) and vendor labor/parts together.  Vendors resist and don't use VAWS. With Coupa it's not needed anyways. A PO is created right away not like JDE. ,Integration with other Tools Needed
Lag to run reports or Lag in general when entering work orders. Timing out of the system with no warning or notification,Usability Issue
SI7 is used at a number of company sites globally - my understanding is we have a universal template that must work for all sites. This means the UI is not particularly intuitive as tasks that are operationally relevant to one site in e.g. India sit in the menu and may be raised by requestors in London - however the task is not relevant to London. Would be great to be able to tailor the UI 'per site' - as I'm sure around the world buildings have different offerings and vocab for tasks etc ,Usability Issue
If the everyday repeated request can populate easily at the start of an entry that would simplify the process.,Feature Request/Enhancement
You may have a way of doing this that I don't know about. Let's say I have a pm ID for air fan. Well that ID for that all the air fans in the building are the same. I can't get SI7 to assign the af on one floor to one tech and assign another af to a different tech automaticly. I have to send all af to myself and then assign them to my techs. Waste a lot of time.,Usability Issue
Fix some technical issues the work orders sometimes have and have a faster system.,Performance Issue
I am kicked out of the system regularly when working for long periods of time.  Overall it is a good work order system.,Performance Issue
It would be beneficial to be able to make copies of WOs.  Site number/location codes would be useful in the WO number.,Feature Request/Enhancement
"It is difficult to track work request.  It would be better with without the need for ""like"" or ""%"".",Usability Issue
It shouldn't take 22 steps to create a work order.,Usability Issue
1. PM library access to be restored since Jarvis access is still not available 2. vendor database: Multiple vendor record for same vendor creates confusion. Should be cleaned up. 3. JDE interconnection: more stable JDE data transfer to avoid delay in invoice processing,Integration with other Tools Needed
There are certain functions with the system that I wish were a little easier. ,Usability Issue
I cant see what inside the request writing when I controlling my work section.,Usability Issue
the options within the portal don't align with some of the requests needed here on site. i have to select drop downs that don't apply and then provide specific directions within the comments section. ,Usability Issue
Sometimes the available options in the pull down menus don't line up well with the actual issue.  I'm not aware of a good way to filter requests only by my buildings.  The dashboard and the service history report show me every work order in the company.,Usability Issue
"The only complaint I have is that I have to close orders on my mobile device, It would be so much easier to do all from desktop or if we have a windows based Ipad or notebook",Usability Issue
SI could be more user-friendly in part of asset database changes - bulk modifications etc,Usability Issue
"Mobile aMFM:  This is the simplest tool to use, as it is more intuitive, but I don't like the following points: Very tricky to find the correct problem code. I keep typing in keywords until I find one that best suits my problem. I don't like the way of indicating nonconformities in building inspections. There are 3 stars and they indicate NA, No and Yes. I don't think it's functional.  Si Request: This tool inserted in the customer portal has a straightforward layout, but it is not easy to find the problem code either. Customers mostly open the wrong ticket, which causes the wrong priorities  Service insight portal: The site is not intuitive at all. I really don`t like to use it. To open a WO is very confusing and I don`t know one single person in my contract that uses it. Public export filters need some extra knowledge to use them. Quick list filters need to be exactly accurate with the data we want, otherwise, they won't appear",Positive Feedback
"More focused needs to be placed on actually paying the vendors on time, and maybe shifting from the 90 day payment terms to a shorter timeframe. The payment process alone has been hurting our relationships with vendors. ",Business Process Doesn't Match
"It would help if there was more consistency with SI desktop, iMFM, and VAWS. The way you see the same data is so different between each application. ",Data Issue
As a new manager here at Cisco I am not up to date yet on all the processes used so I will need more time to make a sound judgement,n/a
"Some of the sub-categories are not obvious, such as ""other services"", etc. when trying to find the issue you're trying to address.  Meeting room set-up should be easy to find, etc.",Usability Issue
I would like to see the due dates before I open the work orders.   ,Feature Request/Enhancement
Service Insight could move a lot faster. It has a lot of glitches,Performance Issue
"The tool is not practical, it is very inflexible and does not allow full visualization of work orders. Where information can be consulted, maybe I DON´T know to use it and exploit its potential.",Training Needed
"as a recording tool it does the job, I have the ability to use SI and imFM for the same service, it is unfortunate that they are not more similar in use. so, I only use the computer it is faster. I spend too much time on using it but it is required.",Feature Request/Enhancement
"I find the system, especially when coupled with Coupa/MyBuy to be very bulky and confusing.  I work with it since it's what we have, but would prefer something more streamlined.",Usability Issue
"Service Insights is a necessary tool to use for properly doing my job. I do however find that there are a number of glitches that occur that can make things difficult. But overall, it is a helpful tool.",Performance Issue
"Coming from using Corrigo this system is less efficient, slow, and lacks some of the tools other systems have. ",Performance Issue
"1. Unable to use open SI on multiple accounts at the same time. eg: WAYMO and ANZ 2. There are instances when I cannot click on NTE request, not sure if the system will time out by itself. As a work around, I log out and log in, most cases, twice just to ensure the button works. ",Performance Issue
Perhaps more access for techs. ,Access/Availability Issue
"We also use VAWS a part of the Service Insights suite.  The tool is useful because it is what we have. However, I have experienced some difficulties with the setup/configurations. For instance, the Set G/L-subledger.  Also, accessing some of the actions through tabs and others through grids.  A person could miss that all together.  I have submitted several enhancement requests and can't wait to hear the results. ",Usability Issue
Make it more user friendly and have more info on the assets we have onsite. Give us the ability to add/change asset info. Make the call entry and compleation process easier and faster to complete. Make the app easier to use. Text our work phone when a new work order is made and when they are coming due. Create a bar code scan tool. Customize check list for PM and job steps. Have better unit info and ability to add asset to new work order for tracking. Have a real time help line for techs having trouble with SI7.,"Usability Issue, Feature Request/Enhancement"
Not very robust nor intuitive interface. Personally I   would like ( among other things ) better print options so that one can print out task lists/ procedures etc into hardcopy instead of being fully limited to referring back to electronic device all the time.,Usability Issue
Please look into a more user/vendor friendly system.  Going to multiple sites isn't very efficient.  This current SI system is cumbersome at best. ,Performance Issue
"Serviceinsight provides really good service. However, sometimes the Si7 takes a long time to load on Job Steps.  And it won't be able to type on the next service list box until the last one has been autosaved. ( For the PM work order that I have, it has 80+ list inspection items, it will take a while) if the job step can provide the customer with a manual save/autosave option or upload faster, that will be wonderful.  Thanks",Performance Issue
a more modern interface,Usability Issue
Not too sure what's ServiceInsight is. Was not introduce to the team.,"Data Issue, Feature Request/Enhancement"
"There are a good amount of general usability problems such as the ""View Service Request"" functionality and your ability to easily identify status changes/updates to your open work orders.",Usability Issue
"Sometimes the platform as such has speed problems or integration with other platforms, for example: MyBuy, generation of emails or notifications, it is slow to load files","Integration with other Tools Needed, Performance Issue"
"I think there are too many steps to rise a ticket. it is small things each of them but taking time in total. for example, need to click ""start"", type and select my name after login to the system and need to type the request and completion both. need to click a dispatch..  Daily basic request, we do not have something particular to type comments, so I hope I can rise a ticket without key board, just using only mouse is better then.  ",Usability Issue
It could include parts listing,Feature Request/Enhancement
"Mobile app version can't be logged in and used. Desktop version is not user friendly, slow to load data and very difficult to use the filtering function.",Performance Issue
"Sometimes when I sue the Chinese vision, The  WO completed time will in the future time.Not the input time.   And I want to create the PO from si7, if I use the Chinese description , sometimes will no PO create  in Mybuy.",Integration with other Tools Needed
Perfect,Positive Feedback
To be able to cancel or approve PO's,Feature Request/Enhancement
Improve the reporting system.,"Data Issue, Feature Request/Enhancement"
It will be a great help to save time when you have made an FCR wo and have entered documents so that they are transferred to the SUP wo/Po you make,Feature Request/Enhancement
After crush in april i have problem with Target time is ''Quick list new'' because the date is constantly changing...,Performance Issue
make more user friendly,Usability Issue
Entering a ticket thru the call entry with a timer feels very controlling and old fashioned.,Usability Issue
No comments,n/a
I think I need some training sessions. It´s good to have a plan to introduce SI and improve its use.,Training Needed
"Seems like the program hasn't been updated since the 90's, it looks very old and not user-friendly",Usability Issue
Service Insight is a very outdated program which often crashes so you have to reload and is also very slow program. This is very frustrating and time consuming. ,Performance Issue
Clearer method to retrieve WO's accidentally/incorrectly closed.,Usability Issue
"The performance and speed leaves a lot to be desired - you wait MUCH too long between steps. besides, you don't need this confirmation pop-up at all. You need two clicks each time and accordingly more time for a confirmation that a work step is done. this extends the time for a WO additionally.",Usability Issue
Many are times am not able to log in to SI 7 i keep getting messages to contact administrator to unlock my account. the downtime on SI 7 is also not good at all,Usability Issue
"I find warnings every time a ticket is entered and I think it's a debug. often does not send the email to the requestor. to print a ticket you have to do 6 different steps, this is a big waste of time",Usability Issue
Frequent logouts from the program.,Usability Issue
"SI7 is always extreme slowly even i use Edge, chrome, deleted cookie and etc. and SI7 has bad optimization for the web interface - i use 32 inches monitor and it shows just 10 row on one screen",Performance Issue
"In comparison to NVS's tool, SI7 is complicated, overpopulated with options (for office needs) and visually overcrowded. ",Usability Issue
SI7 can be quite slow when raising a ticket. I would like if there were click buttons to acknowledge a ticket as opposed to going in to the menu to change the status. I work on Reception so I can get easily distracted with Visitors.,"Usability Issue, Performance Issue"
older version you were able to back date when completed... this system is more suited for a service company rather than in house facilties,Business Process Needs to Change
"main issue is lagging of desktop site, every click can be a few seconds that all add up therefore less likely to usse it to full potential , also site and app logs out user too quickly so forever logging on, biometric log on in mobile app would be good ",Performance Issue
"Do some research on the market and check how modern applications work. For example Singu FM or many, many others.",Usability Issue
Cannot reassign to contractors with the mobile app. This would be very helpful,Feature Request/Enhancement
"It would be more practical if PA tickets were enabled through the mobile app as well. Currently there is no option to modify the type of ticket from SR to PA. The system level tree could be improved. If a ticket is opened on behalf of the client, they have no visibility on it. It would be beneficial to have key subcontractors on site have access and be able to open tickets like in the previous application (canteen, 3rd party maintenance, security, etc.). It would also add greatly to the usefulness if the platform was available in local language. Many of the manufacturing staff on my site does not speak English. It seems that the review function does not function properly. The customer receives the email, but when they click on the link it either says it has already been used or doesn't open the review platform.  It would be a more useful tool if the navigation/usage etc. was more practical.",Feature Request/Enhancement
"SIRequest bug reporting system not working. Even though we are supposed to launch it from July.   We have a test group at the client's. I receive information from the client that they can't submit a request or log in, I get login errors that we don't know what they mean. I've been getting a different error every time since last week and I can't complete the request every time. Below is a test login from this morning, I supposedly logged in, but I can't send the application",Technical Issue
There are a lot of restrictions in SI that make it a difficult program to self-serve in and to customize to improve the customer experience. Navigational functionality steps do not make the user experience efficient. I have a list if interested. 256-990-9087,Usability Issue
I can be more interactive and user friendly. ,Usability Issue
"The system could have local support, able to serve each market and training materials translated into several languages ​​for use by the managers of each contract, in addition, new users when registering do not automatically receive a password as already done in the past. thanks.",Training Needed
"It would be awesome if there was a field indicating whether or not the property is leased, owned or partially managed.",Feature Request/Enhancement
