USER COMMENTS,Tags
Give super users mpore access,Access/Availability Issue
have to re-login every hour or so,Access/Availability Issue
maybe extend the time before it times out.,Access/Availability Issue
more access. ,Access/Availability Issue
"Please roll this out for office as well, this is a great product and truly makes CBRE a market leader. ",Access/Availability Issue
Still would like to see different team access.,Access/Availability Issue
I wish it was also available for retail and office properties.,Access/Availability Issue
"The thing I dislike the most about fmPilot is when I am putting together a larger quote. I have to pay attention to the time and click save every 5-10 minutes. I have had on multiple occasions where ive put together very large bids taking me over 30+ minutes and when i go to save it will like time out and ill loose everything from my quote and have to start over completely. The next thing i dislike is when I invoice a job, we have to wait for pending verification. Even though i have the invoice completed and submitted. I feel like if our invoice is already done, we shouldnt have to go back in again after verification status is complete, just to change the status again for our invoices submittal. When im done with a job, i invoice it and when the store verifies. That should be it, I shouldn't have to go change status again to submit our invoice. I forget about this all the time and it causes us more days waiting to be paid for our work. Or if we already have a signed work order, why do we have to wait up to 3 more days for the store to verify the work is done? If a Manager signed our work order, isn't that already verifying the works been complete? My last complaint would be when i get a work order with a DNE on it. I go out and look at the job to inspect and verify what all is needed to complete the scope. I dont get a MOD to sign the work order at that time, as i have the intent of doing the job. However, their have been times where i complete an inspection and get back to my office. I run the numbers for labor and material, realize i need a DNE increase and submit a quote. My quote doesnt get approved and i invoice for incurred. Then the invoice gets kicked back because i dont have a signed work order, this has happened at least 5-6 times. I dont think i should have to get a signature on a work order when we dont complete the scope thats detailed on the work order. I also shouldnt have to drive back out to a property for a signature, just for the cost of 1 trip charge. We have had to do this before as well and its more of a pain and takes more time to deal with it then what our trip charge is worth. I think a different way to invoice for our incurred trip charges should be available and they shouldn't require a signed work order either. ","Access/Availability Issue, Business Process Needs to Change"
"We were on a phone call with Rick and discussed the many things that the site needed to change. Locating duplicates, being able to share data with people outside of your team, and other things that were discussed in our meeting.","Access/Availability Issue, Data Issue"
 It can be very glitchy and slow at times- Also the client side only works on firefox. ,"Access/Availability Issue, Performance Issue"
The best! We need to promote its use for all product types and make it a differentiator in winning tenant rep business,"Access/Availability Issue, Positive Feedback"
This is all geared towards Industrial and we have office properties too.,"Access/Availability Issue, Usability Issue"
"When I put in an EMERGENCY repair order and, six days later, I still haven't received a service call or even a phone call, I'd say major improvement is needed.",Business Process Doesn't Match
"It would be better if we could contact someone easier when something happens.  Also, The system isn't very user friendly.  It should have more warning pop ups when something is missing or different.  Thank you.",Business Process Doesn't Match
CBRE to dial back the spam calling and emails . Spending more team on admin / emails than in-field monitoring . This will help big time in service ,Business Process Doesn't Match
Clearer communication on status of open work orders. ,Business Process Doesn't Match
Using better vendors that can make the repairs better. Some of the vendors that show up are very sketchy.,Business Process Doesn't Match
It would be nice if we could get better/easier communication in the portal.,Business Process Doesn't Match
Work with the same urgency in trying to get us to take a call as doing the invoicing / approval. When trying to get help we have gone weeks without answers. ,Business Process Doesn't Match
Better response to issues. ,Business Process Doesn't Match
More timely completion of work orders. ,Business Process Doesn't Match
Too much in and out of orders to get something invoiced and processed. ,Business Process Doesn't Match
"Communication, updates, follow up, e-mails etc....",Business Process Doesn't Match
Simply process. Allow vendors to reach out to you. ,Business Process Doesn't Match
"communication with the location is very crucial, especially with response times. ",Business Process Doesn't Match
Communication needs improvement ,Business Process Doesn't Match
Been trying to get a facility added to me for over 4 months. Have been approved on my end but is still not on my company profile. Need IT help that users can call instead of constantly having to call CBRE for them to send e-mail to IT but  IT never calls back to help.,Business Process Doesn't Match
"When trying to contact someone via email through the portal it is takes forever to get a response, if at all. There needs to be better contact information for getting a hold of a responsible party for questions. ",Business Process Doesn't Match
better vendors  / less expensive and local ,Business Process Doesn't Match
"Communication is poor between our station, Fedex facilities maint. CBRE and the contractors. Everyone should be updating the work orders so everyone knows what is going on and updating all and any updated timelines for completion.",Business Process Doesn't Match
"actually come in when we ask you to, and when something is set to a HIGH PRIORITY it is treated as such. It is not acceptable to have to a rodent infestation. Thanks. ",Business Process Doesn't Match
It takes far too many attempts to get our vendors to due what they are contracted to do.  IE. sprinkler turn ons.  We need more accountability from our vendors to do the scope of work they bid.   ,Business Process Doesn't Match
"All categories would have scored a 10/10 if the stores didn't have to separate ticket requests from IT/maintenance.   For example, LP card reader problem is a selection on the menu but in reality you have to call IT to get a ticket.  Another example is: if you are having trouble with getting music into your store you have to call IT vs submitting a ticket to FM.   To streamline the process of store maintenance  and to spend less time on deciding where and/or who a ticket needs to be submitted to, please combine all ticket request into one facility.  ",Business Process Doesn't Match
Work orders and responses to work orders have taken longer than normal.,Business Process Doesn't Match
We use it because we were told we had to- its an extra step for me that wasn't needed,Business Process Doesn't Match
"More communication between facilities and store when ""crew/tech"" is assigned, delayed or canceled.",Business Process Doesn't Match
VENDORS OR CBRE SHOULD ALWAYS BE SURE COMMENTS ARE UPDATED IN PORTAL,Business Process Doesn't Match
Needs to find local vendors instead of 4-5 states away.,Business Process Doesn't Match
It really isn't designed for what I needed to request (shelving and moving electrical outlets) but it was required to use.,Business Process Doesn't Match
"On seasonal work orders.  Once the status moves to ""Closed"", There's no way to tell the Tech if a work order has made it's way through the billing process.  For example:  A PMEX or OOS work order will go to PVINV status.  We can see the the various stages all the way to ""Completed""",Business Process Doesn't Match
everything went well but when sent order I do not like diferent contractor it kind mess up because the first one contractor with plumber few week later i had to sent call back they send different contractor plumber over and kind waste money to do. ,Business Process Doesn't Match
improve communication ,Business Process Doesn't Match
Response time on tickets is very long. It takes much longer for service since we have switched to CBRE.,Business Process Doesn't Match
Simplify  Easier communication Better support,Business Process Doesn't Match
Pay our vendors quicker. Answer calls and return calls quicker.Find vendors that are not so expensive to use.,Business Process Doesn't Match
Accuracy in work orders would be best. So long as the work orders are accurate with what the service providers know or are experiencing then it would be a huge improvement.,Business Process Doesn't Match
"I have put in many Work orders in, and found that the Vendors coming out to service will only do what is on work order rather than calling in and getting approval; if something was missed in work order and getting approval for completing other items that were missed when making work order. I am Dissatisfied with this service. I have to make a new work order and a new charge to the clinic to have them come out to facility and make appropriate repairs, when they could have added to work order in with approval for similar scope of work. I hope this issue could be addressed due companies are over charging DaVita for good customer service.",Business Process Doesn't Match
"Problem is we do these tickets, but it takes too Long to Get Results from GFS.  The GFS Tech can delete tickets and change ticket to whatever they like.",Business Process Doesn't Match
"I am told to stop and complete a different form for changing door lock codes, but I cannot locate that selection. Please provide a link. ",Business Process Doesn't Match
quicker responses  sometimes response can take a few days sometimes they are responded to right away.  more consistency on response time,Business Process Doesn't Match
Respond quicker,Business Process Doesn't Match
when we input notes no one from CBRE response ,Business Process Doesn't Match
Quicker response and more follow up. Vendors that can get parts and complete repairs in a shorter time with more reasonable rates.,Business Process Doesn't Match
It would be nice / helpful  if I could get a response to my messages at the comment section.  When CBRE rep enters a comment / message I respond immediately but when I enter a comment its crickets. ,Business Process Doesn't Match
"when the client cancels a service request, update and cancel so we don't still go to the location, and then the customer incurred travel cost. ",Business Process Doesn't Match
Get reliable vendors that know how to fix things and don't over charge like the ones you have now!,Business Process Doesn't Match
Communicate and arrive in a timely manner,Business Process Doesn't Match
Better Skilled Communication with FM Pilot individuals who can provide an answer and get things accomplished.,Business Process Doesn't Match
"Updates to stores about what is going on after the ticket has been issued and someone sent out and then waiting for someone else to approve something. Need more follow up on repeat issues for our roof, ceiling tiles, leakage, etc. Ongoing issues for the past two years and still isn't resolved is a big issue.",Business Process Doesn't Match
Pay past due invoices!,Business Process Doesn't Match
Better service.,Business Process Doesn't Match
More communication on when we can expect a vendor,Business Process Doesn't Match
"We a ticket is created we dont get updates.
if we add notes or comments to a ticket it goes un notice. We always have to call in for an update week(s) after to follow up. System needs to be better at following up with stores who need the work done in a timely manner ",Business Process Doesn't Match
"Pay within terms, not 60 to 90 days late.",Business Process Doesn't Match
takes too long for someone to come and the repairs don't last ,Business Process Doesn't Match
COMPLETE THE WORK ORDERS,Business Process Doesn't Match
"Train staff better to know that PM services are a flat rate when we invoice them. We received 3 invoice rejections this morning, when we have been invoicing them the same way for years. This cuts into other work our office staff needs to be focused on and is extremely frustrating. Also, if there is a SOW or checklist for any jobs, please make sure they are attached to the job instead of asking us to provide a checklist we don't have.",Business Process Doesn't Match
"always issues, vendors don't show up, it takes forever to get something done, lack of follow up.. ",Business Process Doesn't Match
Vendors do not update portal with comments or attachments,Business Process Doesn't Match
Knowing who is coming and having the same people come to fix issues would be very helpful. Calling befo0re every visit to let the front desk now when and who will arrive would be very helpful.,Business Process Doesn't Match
"Work orders are dropped, not monitored and not completed. I can't find several work orders I have entered and that were never completed. Follow up with the contractors assigned the work order needs to be done regularly until it is completed.",Business Process Doesn't Match
Couple issues I have is that I check my app every morning but we don't get a lot of work orders as often as we should we are lucky if we get 2 a week and the follow up team isn't very helpful once you have questions about quotes of follow ups on workorders however the help desk people are one of the best customer service representatives I've ever had to deal with,Business Process Doesn't Match
"Sometimes there will be miscommunications between the center, CBRE and the techs/company that show up on site",Business Process Doesn't Match
Yall need to get the right people in to do the repair not the cheapest you can find,Business Process Doesn't Match
Have vendors complete work orders,Business Process Doesn't Match
"In regards to the UI, I have no complaints. Sometimes I come across mosaic tickets that are mislabeled, the alarm details and source info will not match the mosaic ticket title. I believe this is more of a programming or routing setup issue though. ",Business Process Doesn't Match
We are unable to reopen work orders that have been closed but are incomplete or incorrect. When comments are added to work orders by center staff there is little to no follow up from CBRE on those comments. ,"Business Process Doesn't Match, Performance Issue"
The work orders get closed and work has not been done and we are not advised why it was closed or if it was submitted to an outside vendor until we call  and sometimes we lose track so it could be weeks before we find out what is going on.  ,"Business Process Doesn't Match, Performance Issue, Usability Issue"
Make it more user friendly and easier to get someone on the phone or email back quicker,"Business Process Doesn't Match, Usability Issue"
Work orders do not get resolved quickly. The site doesn't work when trying to view all work orders.,"Business Process Doesn't Match, Usability Issue, Performance Issue"
Provide exact payment dates.  It's significantly challenging to purchase needed materials to complete WOs timely when payments are made more than 30 days after completion of work order. We are expected to complete WOs timely but are not compensated timely. ,Business Process Needs to Change
"Quotes should be uploaded so we at the facility see what the vendor is quoting for work.  When written communications are sent, the person entering the order and/or the person listed as secondary contact is included.  Vendor be held accountable for uploading reports quickly - their invoices are held until they have completed this step - we are have requirements to have documentation on file for annual services.  We have to keep checking back on the work order for months sometimes waiting for the reports to show up.",Business Process Needs to Change
To be able to have to correct information and the necessary resources to contact the person or person in charge of the account. I don't understand that when you guys need some information you will call and CC the whole company. ,Business Process Needs to Change
Better communication between fmpilot and vender,Business Process Needs to Change
Make the email updates relevant and timely.  Dispatch to vendors sooner.  No reason a ticket should take several weeks to get an update on.,Business Process Needs to Change
ancering the telephone more frequently,Business Process Needs to Change
pay faster - its about cash flow and I am still waiting on payment for Jobs we did in July.   The best vendors have the ability to pick and choose who they work for not wait or beg for payment.  I work with multiple third party payers and CBRE is the slowest to pay.   Also communicate when bills will be paid.,Business Process Needs to Change
I'm still good with the interface but could have some improvements with the correct trade match from client-side to IFM to avoid rework.,Business Process Needs to Change
Communication with facility. So many different technicians from different agencies. Maybe a follow up call or email to the AA  so she can expect a certain agency instead of one agency today and another tomorrow and nobody knows what to do or when to do it. Mass confusion  here on work orders.,Business Process Needs to Change
My clinic does not have a maintenance person to trouble shoot or prevent $$$ losses. Would like to have a person that can maintain the property. I am now noticing the refrigerator making an unfamiliar noise but nobody to check and do preventive maintenance.  ,Business Process Needs to Change
"Your NTE's are a joke & your invoice processing procedures are ridiculous- ""PENDING CLIENT INV APPROVAL"" ""PENDING VENDOR VERIFICATION"" etc etc..- we are real close to not using you.",Business Process Needs to Change
Do not allow Out of Scope services to be performed on a Regular Land Service work order.  A PM.,Business Process Needs to Change
There is no way to change the password in reset email or inside the app. We have to send for one every time we want to log into fmPilot. ,Business Process Needs to Change
It would be better to know when there will be scheduled appointments of vendors to take care of issues.  Most of the time it is a surprise and they don't normally have the information we need to determine why they are there in the first place without ome detective work.  ,Business Process Needs to Change
Work order creation should list a designated field into which the point of contact can be entered. Vendors and facility technicians should also receive notices that they must schedule site visits with the assistance of the points of contact for work orders.,Business Process Needs to Change
Allow emergent orders to be done over the app again.,Business Process Needs to Change
find a better way to print and invoice work orders,Business Process Needs to Change
"When creating a work order, fields should exist to designated a point of contact for the work order. Work orders should also be transmitted to vendors such that the vendors receive special notices to contact the point of contact before they arrange for any site visits.",Business Process Needs to Change
Timely follow ups on WOs,Business Process Needs to Change
it would be nice to be able to place urgency of service on escalating scale  ,Business Process Needs to Change
Fix the system. Some specific client domains are not working/too slow to load.,Business Process Needs to Change
It's sometimes difficult to get a response to questions.,Business Process Needs to Change
"Either remove or improve the IVR check in process. All my techs have issues with it. Notify the person who created the work order when a comment is made so they can give an answer. I never receive replies to my comments. Come up with more a chat based program for customers and suppliers. Needs to be far more user friendly. Come up the an ""action required"" option on the work order tab. SO when answers are needed someone specific is notified. ",Business Process Needs to Change
Answer the messages we put in the portal :)   Tell us quicker if our tech is NOT going to get an increase so we can send him to his next job and not waste his time waiting.   Give us DIRECT contact numbers to call!!!! It is frustrating to call and not get a designated person. ,Business Process Needs to Change
Validate vendors better. Reaction time to emergency work orders,Business Process Needs to Change
streamline updates by removing the need to choose what company to update and just making them use a universal system/code so you can get in and out,Business Process Needs to Change
Needs to be a better way to directly contact someone regarding outstanding work tickets ,Business Process Needs to Change
CBRE FOLLOW UP NEEDS TO BE IMPROVED ,Business Process Needs to Change
"When I update our schedule date and time in fmPilot, we still get emails asking us for a schedule date. What's the point of putting it in if we are going to be asked about it again in an email? ",Business Process Needs to Change
ETA times updated daily ,Business Process Needs to Change
It would be nice to add comments to work orders without having to know someone's email address. ,Business Process Needs to Change
More Communications,Business Process Needs to Change
Emergency addressed quicker,Business Process Needs to Change
"I'm not sure how this can be improved. On the Vendor's side it's definitely easier to just talk to our contact directly, and set up the work orders on our own system. Now we have to do both. One in our system and one in the Vendor program. Many companies are switching to vendor programs and they're all different, so we have to learn each one. It's time consuming to say the least.",Business Process Needs to Change
My only issue is with calling into the IVR system.,Business Process Needs to Change
Fix you IVR call in system. ,Business Process Needs to Change
"allow uploads to be deleted if neccessary -have people actually read the comments  -give contact info as to who to contact if have issues with the web#  - have a few more choices under Remedy/Cause, example- needs an electrician","Business Process Needs to Change, Data Issue"
"It would be helpful to be able to know more about the status of various requests, what progress, or where in the process FM is. For example, we have submitted a number of requests over the years to have an old walk-behind forklift removed (it does not work), but have never seen any movement on it. Anyway, you have been very responsive to our various other requests that, and I do appreciate it.","Business Process Needs to Change, Feature Request/Enhancement"
Putting PM's on a better schedule and have the due date prior to the expiration date of inspections.   Better follow-up notifications  ,"Business Process Needs to Change, Feature Request/Enhancement"
comments being reviewed before reaching out. possibly a feature that shows the latest update to assist with that.,"Business Process Needs to Change, Feature Request/Enhancement, Data Issue"
When emails are sent have tech with an extension when we have certain things come up like onsite approvals needed and the IVR has been messed up since the phone system was updated and checking in and out has become a chore,"Business Process Needs to Change, Technical Issue"
Use a usable UI. Also most calls come in at 1 o'clock and we are 2 hours from going into overtime already.,"Business Process Needs to Change, Usability Issue"
Try to cut down on the redundancy of repeating the same question several times to complete a process.  IE:  when invoicing for example. I have to put the job description in several areas and attach an invoice with the same description on it.,"Business Process Needs to Change, Usability Issue"
"It would be easier to log in once and not have to log in and out a million times a day, also quoting is a pain since you have to paraphrase your work recommended.","Business Process Needs to Change, Usability Issue"
"Scrap it and start over.  Model Service Channel.  FMPilot is clumsy, especially with building a quote.  Also, service provider should be able to submit a quote/RFP without needing to wait for a work order from the client.   This is one of the worst client websites available.","Business Process Needs to Change, Usability Issue, General Negative Feedback"
"Terms used in email, phone conversation, text, page to page, clickable items, abbreviations, and acronyms, all should be the same and read the same way for everything. ",Data Issue
"Know the HVAC Units and their parts before rejecting Invoices for things out of our control.  Example: A Direct Drive Unit does not have belts, but we get rejections for no belt photos ALL THE TIME.",Data Issue
There are not enough choices for issues,Data Issue
Data extraction is not always accurate ,Data Issue
"Details should be provided in column for specific things. Like Project, Purchase items, Quantity and Cost",Data Issue
the status updates online could provide more info related to the work that was completed as well as be better matched to the actual situation on the ground.  Sometimes status updates too late or too early to reflect what has actually been done.  ,Data Issue
improved choices for coding of work orders,Data Issue
more choices to select from. ,Data Issue
There doesn't always seem to be the right option to put a work order under. ,Data Issue
