,Comment,Tag(s),,
Facility Manager,Making the symbols for all the different aspects more user friendly - i am not computer savvy so to try and understand some of the symbols and to navigate can be difficult,Usability,"Reporting, locations",Negative
Facility Manager,"Many if you want to contact me directly (todd.lidstone@cbre.com). When using Site History, after looking at one WO you have to re-do the search again every time (not very functional)",Usability,PM,Negative
Technician,Maybe find when payments were made eaiser,Usability,,Negative
Facility Manager,maybe make app usage easier ,Usability,"iMFM, Problem codes",Negative
Facility Manager,MFM  needs a total overhall. ,Usability,competitors,Negative
Client/Customer,"Mobile ServiceInsight needs to be more file and folder hierarchy. Dumping 120 workorders and only being able to navigate by target date, building site, or when the work order was produced is redundant. I use the tool ""building"" to look at all the work orders on that site but wish it would further breakdown to ""Fire LIfe Safety"" tabbing or highlight  in various colors to depict which work order needs attention first or have the ability to make those changes as a user. The limitations of the mobile app are as useful as looking at a click and look webpage. I would love it to be more interactive.",Usability,Problem codes,Negative
Technician,more choices to select from. ,Usability,"login, iMFM",Negative
Client/Customer,More user friendly ,Usability,"Problem codes, client",Negative
Technician,More user friendly ,Usability,"iMFM, mobile",Negative
Technician,"Most of the extended search features don't come in handy.  Would be helpful if we could just search by Store name or Location #.  Currently, we have to know the CBRE client code and whether there are zeros in front of the location # to search.  The WO# search feature is helpful but sometimes we don't have that # so the store name would be helpful. Would be helpful if there were 2 columns of work orders, one showing the default that is visible now and then one for the in progress work orders.",Usability,,Negative
Technician,My clinic doesn't pop up when I first sign in.  I can't search for it.  I have to sign in multiple times before my clinic pops up,Usability,Desktop,Negative
Facility Manager,"Navigation is brutal.  Toggling back a screen is awful and you have to start completely over again.  Ex: Site history - list populates - dive into WO, back out and have to re-enter parameters again, instead of going to the previous screen",Usability,"Request, mobile",Neutral
Facility Coordinator,Need more options that pertain to certain things within the office. Such as issues with the clinic chairs and television problems in the clinic.,Usability,,Negative
Customer Service Rep,Needs a more advanced and integrated search feature/system. This program is convoluted and cumbersome to navigate through. Nothing about the program is anywhere intuitive,Usability,client,Negative
Facility Manager,Needs a UX overhaul badly. This is not intuitive for a general employee NOT involved in facilities.  ,Usability,Request,Negative
Facility Manager,needs more options for like when people reject a quote or want a revised quote and leave it in quote rejected,Usability,"WO, search",Neutral
Technician,"New UI is very slow, especially for SBH",Usability,WO,Negative
Technician,no suggestions.  It is very user friendly.,Usability,"WO, mobile, iMFM",Negative
Facility Manager,"No way for Providers to manage work orders apart from account teams seeing updates, forcing providers to use or invent an alt way to manage work orders.   Many glitches, when submitting quotes,   IVR info not clearing identifiable or editable.  Slow,   To long to pull reports, and reports often are not robust enough.   ",Usability,,Negative
Customer Service Rep,NOT a user-friendly platform. The page is often slow or unavailable. Even moving through the process to submit a quote or proposal is clunky.,Usability,"WO, client, Problem codes",Negative
System Administrator,Not easy to work with,Usability,,Negative
Facility Manager,Not having to refresh so often. ,Usability,"WO, vendor, email",Negative
Facility Manager,Not make the page so busy. Less is more,Usability,"WO, search",Negative
Facility Manager,not that user friendly,Usability,Request,Neutral
Facility Manager,Not user friendly ,Usability,,Negative
Facility Coordinator,"not very easy to visually look at, not very user friendly",Usability,,Neutral
Client/Customer,not very intuitive,Usability,,Negative
Technician,Not very intuitive for picking correct categories,Usability,"Request, email, printing/pdf",Negative
Facility Manager,Nothing is straight forward or simple.  Revamp whole system,Usability,"platform, client",Negative
Technician,"Now that I'm used to it, it is somewhat easy to use. It was somewhat hard to learn, and I still learn new tricks and features all the time. I NEED it to do my job. It has been pretty solid lately, not crashing or locking up. For a while there, I was copying every longer comment, just  in case it decided to give me an error message.",Usability,"WO, PM",Negative
Client/Customer,"Open WOs in seperate tabs of browser (chrome, edge) will save a lot of time. ",Usability,dispatch,Negative
System Administrator,Page times out to soon. Also more room in scope of work would be very helpful.,Usability,login,Negative
Facility Coordinator,Placing fmPilot on the V dashboard would really make it more convenient. ,Usability,"WO, search",Negative
Facility Manager,Please make more user friendly!,Usability,"Request, WO",Negative
Technician,"Put a limiter on how many times a day it's going to ask the same user for feedback on the program. I'm sure this survey is going to produce highly accurate statistics to base changes on with all the duplicative results, but perhaps allowing one submission per person would be an alternative approach.",Usability,"Attachments, PO",Negative
Facility Manager,Putting up the financial information - if that could be made easier / more fluid; that would help.,Usability,"WO, PO",Negative
Technician,Remove the additional OK buttons and be allowed to conduct multiple tasks within the same frame or screen ,Usability,,Neutral
Client/Customer,Reports generating are not user friendly. ,Usability,mobile,Negative
Technician,"Scrap it and start over.  Model Service Channel.  FMPilot is clumsy, especially with building a quote.  Also, service provider should be able to submit a quote/RFP without needing to wait for a work order from the client.   This is one of the worst client websites available.",Usability,"WO, priority",Negative
Technician,Se traba seguido,Usability,Request,Negative
Customer Service Rep,Search for work orders needs to be narrowed down.,Usability,,Negative
Technician,searching for stores workorders when you don't have the WO#. It should pull all orders whether open or closed.,Usability,"WO, PM",Positive
System Administrator,Searching is awkward and slow,Usability,login,Negative
Facility Manager,"Seems like the program hasn't been updated since the 90's, it looks very old and not user-friendly",Usability,Attachments,Negative
Facility Manager,"self generating work orders are over complicated being that you have to put your information in several times instead of a quick problem/ solution work order with labor time.
",Usability,"iMFM, WO, Desktop",Neutral
Technician,ServiceInsight is a great tool for collecting information and seemingly for dispatching work and tracking open tasks.  The system seems a bit cumbersome when trying to look for specific work order/PM's because of the limited screen layout. ,Usability,"Desktop, mobile",Negative
Facility Coordinator,SI could be more user-friendly in part of asset database changes - bulk modifications etc,Usability,"WO, PO",Negative
Technician,SI7 needs to be more user friendly. It takes a lot of steps to get to where you need to go. If you can lessen the steps to say get to reports or PM'S to adjust it would be easier. ,Usability,,Positive
Technician,"Simplify the work order to invoice and propose. too many steps. We work with SMS assist, and it is easy compared to yours. Has all work orders, tabs for communication, pictures, invoice and proposal on each.",Usability,,Positive
Client/Customer,"Slow, difficult to navigate",Usability,WO,Negative
Technician,So far very easy to navigate no issues ,Usability,Reporting,Negative
Facility Coordinator,"Some of the sub-categories are not obvious, such as ""other services"", etc. when trying to find the issue you're trying to address.  Meeting room set-up should be easy to find, etc.",Usability,Problem codes,Negative
Facility Manager,somehow making history searches easier.,Usability,"WO, Reporting",Negative
Customer Service Rep,"Sometimes it is not easy to pull up work orders, because the wrong category is selected and you aren't sure, otherwise it's great!",Usability,"WO, search, call center request, job steps",Negative
Facility Coordinator,Sometimes you can not find the correct drop-down category for the work order that you need to create.,Usability,,Neutral
Facility Manager,Start up window does not allow you to fill out boxes. You have to back out and go back in before you can move through the form. I spent 10 minutes trying to make it go forward. finally got mad and backed out! when I went back in I could finish the form.,Usability,,Negative
Facility Manager,streamline updates by removing the need to choose what company to update and just making them use a universal system/code so you can get in and out,Usability,WO,Neutral
Facility Manager,"takes time to open and navigate through and WOs, assigning WOs need to be done individually which sometime it is time consuming need some flexibility especially in search tools, it is not user friendly when need to look for assets and PMs ",Usability,WO,Neutral
Technician,"Terms used in email, phone conversation, text, page to page, clickable items, abbreviations, and acronyms, all should be the same and read the same way for everything. ",Usability,"Problem codes, client",Negative
Facility Manager,"The app could use some improvements, techs have a hard time checking in and out and sometimes work orders take 3-5 minutes to load. Overall the app is very slow. ",Usability,"iMFM, inspections",Neutral
Facility Coordinator,The App doesn't work out in the work field. The app doesn't let you search by site name or filter by site name. The web work orders never have the correct dates on them. Work orders disappear before anything can be loaded to it.,Usability,,Neutral
Facility Manager,"The check-in process is the biggest issue. The automated message cuts you off, you have to try several times to enter a check-in or out. VERY time-consuming. ",Usability,"PO, data entry",Neutral
Vendor,The comments column is much too narrow. It includes lengthy text at the bottom of emails that shouldn't be included. It adds images from emails that are unnecessary ie: logos. It adds photos from emails that have already been added to the workorder. ,Usability,,Negative
Technician,"The feedback/ survey email needs to be changed - I think, we should be creative to ask for feedback messages by changing the font and make it short and easy to read",Usability,competitors,N/A
Facility Manager,"The IMFM format works better for entering work orders, but lacks the flexibility and control that SI7 has in the desktop format",Usability,languages,Neutral
Technician,The interface can use some improvement.  The design looks dated.  ,Usability,login,Negative
System Administrator,The IVR has too many issues.,Usability,,Negative
Facility Coordinator,The length of time spent searching for invoices and many times the assigned location is no the default at sign in,Usability,"vendor, Problem codes",Neutral
Customer Service Rep,"The login & out system is not very good, we often cannot log out due to some error message on the IVR system and cannot manually input times online.",Usability,,Negative
Facility Manager,The navigation of the portal is less than adequate. Searching for open work orders is not easy. You should add e-mail verification once a work order is submitted. ,Usability,vendor,Negative
Customer Service Rep,The notes function and the actual recorded history of the work order is confusing and folks often look in the wrong place! ,Usability,languages,Negative
System Administrator,The overall user experience is lacking. Searching for work orders is complicated. The work order dashboards are hard to navigate through to find the right information. Comments seem to go unnoticed at times.,Usability,,N/A
Technician,The platform is not user friendly at all,Usability,,Neutral
Technician,The preventive maintenance is not friendly. Also is needed in local language and with local job plans and frequencies.,Usability,assignment,Negative
Facility Manager,The search would be better if it was more broad and the input did not have to be exact.,Usability,"WO, Problem codes",Negative
Facility Manager,The system is less intuitive than other WO systems I have used in the past.,Usability,,Negative
Facility Manager,The user interface is not very user friendly and a little outdated.,Usability,"vendor, WO, search",Negative
Facility Coordinator,"The website functions, but is very unfriendly for a user. It would be great if you could open work orders without losing your previous screen and having to re fill in all your search filters. Submitting a quote is always made difficult because if you mess something up (such as too many characters in description or hitting save without a line-item having a description) you lose all your progress and cannot save the quote again, requiring you to start over. The quotes should be able to populate into invoices directly. Communications on the software should appear in a communication box, making it easier to access communications, these communications could appear in a pop up box - like a notification on an iPhone. The website functions properly and my team has integrated to be able to use it, but our jobs are routinely made more difficult because the fmPilot software is not very user friendly/streamlined.",Usability,,N/A
Customer Service Rep,"The work description is limited to 2048, which is very short to explain the issues, describe the steps, and set a recommendation.",Usability,"call center request, job steps",Negative
Facility Manager,"There are a good amount of general usability problems such as the ""View Service Request"" functionality and your ability to easily identify status changes/updates to your open work orders.",Usability,,Neutral
Client/Customer,There are a lot of restrictions in SI that make it a difficult program to self-serve in and to customize to improve the customer experience. Navigational functionality steps do not make the user experience efficient. I have a list if interested. 256-990-9087,Usability,"WO, job steps",Neutral
Facility Manager,There are certain functions with the system that I wish were a little easier. ,Usability,"tickets, PM",Neutral
Facility Manager,"There are issues with current work orders not showing when opening the page or when adding all filters. We find that we have to exit out, or go to another page and then go back to the main page for all the work orders to show. We have had a couple instances where work orders have been closed out before the work is complete and apparenlty its due to a system problem or wrong location assignment in the system. It would be nice to be able to run a report of all workorders and their statuses in order to keep track since the system seems to be innaccurate a lot",Usability,"WO, email, locations",Neutral
Client/Customer,There are not enough choices for issues,Usability,access and record retention,Neutral
Facility Manager,There are too many buttons to push just to submit a quote or invoice. It is also frustrating that you can't just type in the price. Almost all of our quotes or invoices are rejected. It takes way too long to submit. It isn't worth the time it takes trying to get paid for a job we promptly completed. ,Usability,,Positive
Facility Manager,There are too many options to toggle through screens. Things should be streamlined for easy access to know your work order count and current status. ,Usability,WO,Negative
Client/Customer,"There needs to be an easier way to run reports in FMP. The way to set up filters, etc. is not intuitive, is cumbersome to users, very complicated and frustrating.  Also, the only convenient way to search for a work order is with a PO/WEB number. If I'm doing a search and do not have that criterion, I'm dead in the water.  ",Usability,"Request, WO",Negative
Facility Manager,There was a small period of time that the PM was already in the money area and that was nice because I didn't have to enter the same amount over and over.  We get the same amount for every PM so if it is automatic - that would sure be nice.  ,Usability,,Negative
Facility Manager,This is not user friendly ,Usability,"job steps, WO, PM",Negative
Facility Coordinator,"This platform is not user friendly- searching for a site is difficult, searching for anything is difficult.  inputting financial lines is difficult.  ",Usability,"Reporting, vendor",Neutral
Facility Manager,This portal has too many complicated processes for submitting one invoice,Usability,,Positive
Facility Manager,This system needs improvement. It is such a pain to use that I'm debating whether or not to even continue doing work for IFM. Doesn't seem worth it.,Usability,"JDE, vendor, finance",Neutral
Finance & Accounting,This system needs to be user-friendly and less clicking in order to submit a ticket. ,Usability,,Negative
Facility Manager,"Tickets can be difficult to find, especially when they have been closed.  ",Usability,"PM, languages, job plans",Negative
Technician,times out too quickly  ,Usability,,Negative
Technician,To open  a sub PM is too complicated. As well I face often issues by dispatching date of a work order. which is marked in the past and then too late to close properly the PM (wiht a smily green face for success) ,Usability,,Positive
Facility Manager,Too much having to go to the actions tab and select an option from the accepting a WO to invoicing it.,Usability,MyBuy,Negative
Facility Manager,Try to cut down on the redundancy of repeating the same question several times to complete a process.  IE:  when invoicing for example. I have to put the job description in several areas and attach an invoice with the same description on it.,Usability,"Target time, quicklist",Negative
Facility Manager,"UI overhaul focus on lessening the amount of ""Clicks"" required to achieve an outcome.",Usability,Reporting,Neutral
Client/Customer,"Under actions, when submitting an invoice, the option to submit an invoice is much too close to the option to zero and invoice...either some more space between them or if when you choose ""zero an invoice"", there were a pop-up that allowed you to confirm the action rather than just automatically closing it. There also seem to be some glitchy things that if you don't do everything in just the right order, you possibly lose all your work and have to start over...very frustrating.",Usability,"Attachments, job steps",Negative
Facility Manager,"Update filters to allow to search multiple vendors. Even when a filter is built under Reporting, Reports the details do not save and multiple vendors are not saved.  To be able to use the ""Contains, Ends With, Equals, etc"" options in the drop downs.",Usability,WO,Negative
Technician,"Update system to recognize the person logging in. I have been having trouble with that since inception, despite multiple requests for assistance.",Usability,"mobile, iMFM",Negative
Facility Manager,"Very difficult to use, always have problems ",Usability,WO,Neutral
Facility Manager,Very outdated system. ,Usability,PM,Negative
Technician,"we as managers use the FM pilot and desktop version, the App is a different set up. I would like to see a way to access the app better for managers to see what the techs see to help make sure clients and info can be accessed better. The downloads and uploaded forms are not visible to the field techs. ",Usability,"iMFM, search",Negative
Facility Manager,"We love it, it makes our job from check in to invoicing very easy.",Usability,,Positive
Facility Manager,"We need a ""pinned"" comment, we need an additional radio button like the ""emg"" button (need to be able to denote in IFM that there is no water, or no restroom, or no HVAC, et c- right now it's too generic with the RCs and no configurable field to report on for these urgent issues). The assets from client side need to be integrated. The new UI is incredibly unfriendly and the tracking is impossible to navigate.  ",Usability,"email, notification",Neutral
Technician,"When copying quotes to invoice (line items) it always includes the ""STANDARD -- STANDARD--"" writing in the description. Give visibility to clients when a vendor updates the scheduled ETA date.",Usability,,Negative
Technician,When I try to look up vendor work orders it doesn't give me what I need,Usability,login,Negative
System Administrator,"When opening a new work order, it will often not autofill the requestor information making it so I have to reload the application every time to put in a work order.",Usability,,Negative
Client/Customer,When using filters please make it so we can go back a page without having to refresh and start all over again. ,Usability,,Negative
Technician,"When you create child WO's many times it is not working, you should try 3-4 times, or close and reopen it. This is so frustrating...",Usability,,Neutral
Client/Customer,"Work order location defaults to the wrong location than mine every work order.  Too many clicks and menues to create a work order.  do not get updates to my email when wos are approved, finished cancelled put on hold etc.  dont know who gets my WO,  very difficult to search for work orders I have created, no easy way to follow up on work orders unless you write down work orders and check on them manually..  Techs do not have the same work order numbers as I create when they do their work.  ",Usability,"vendor, finance",Negative
Facility Manager,"would be great if i could receive email notifications each time an employee opens a ticket for us. without emails, i have to refresh the page all the time just to make sure we don't have anything pending",Usability,"WO, search, quicklist",Negative
Technician,"Yes, there can be a restructure on a lot of the unnecessary drop-down menus that would be great. Also adding a entry so when we add our invoice, we don't have to input the invoice twice and it can be copied over to your system.",Usability,"WO, PM",Neutral
Technician,"Your app should be simple.  Once you take pictures at the site when work is completed, then invoicing and payment should automatically follow. ",Usability,"mobile, contractors",Negative
System Administrator,"The display boxes in the PM jobs screen, are just small enough to be maddening. There is room on the screen for larger boxes, so you can see all of the details in the PM job boxes that display the PM jobs without having to scroll a half inch, but this room isn't utilized. Also, when checking the Cycle Statuses in the PM jobs, only the work order(s) for one cycle show in the data results list below, even if more than one cycle ran for the time frame indicated - you have to use a drop down for the Cycle Instance field to see all of the cycles that ran during the time frame. It would be very helpful to see ALL work orders that ran during the time frame indicated/selected. ",Usability,Reporting,Neutral
Technician,being more user friendly where it does not want to glitch and runs smooth.  ,"Usability, Bug",mobile,Negative
Technician,"Fix this: 1.I selected ""remember me"" but it never does.  2.The password is generated by CBRE and I can't seem to change it, so I always look it up.  3.The app hasn't been letting me login or when I do sometimes I can't open the work order. 4.At invoicing, there was no Equipment category to bill for, nor did I have a choice for Apprentice under labor. I need these 4 categories to bill: Labor, Materials, Equipment, Trip charge.","Usability, Bug",competitors,Negative
Facility Manager,I think its harder to find your older tickets and the calendar almost never works for us. ,"Usability, Bug",WO,Negative
Facility Manager,It is very difficult to enter work orders.  Most times the website is glitchy and i cannot select my location and therefore cannot enter a non-emergency workorder.,"Usability, Bug",,Negative
Customer Service Rep,"It's not very intuitive, seems to lose work orders, Placing a work order is a little frustrating due to all the prompts. ","Usability, Bug",,Negative
System Administrator,not always able to view work orders - screen will continuously attempt to load and will not advance.,"Usability, Bug","WO, job steps",Negative
Client/Customer,When making a new w/o order and you get all the end and it says you need to add in the “area” box. So you go back to the box and it erases everything you have already input.  Can that please be fixed.,"Usability, Bug","Problem codes, portal",Negative
System Administrator,Can make accessibility and options of status' more available,"Usability, Data Issue",client,Negative
Facility Manager,I would find it easier to use fmPilot if I didn't have to guess what category my work order falls under. Sometimes what I need isn't listed in the category options and I have to put it under General Maintenance/Non-emergency. It would also be nice to make emergency work orders on the website instead of calling them in. ,"Usability, Data Issue",,Negative
