,Comment,Tag(s),,
Vendor Admin,"I'm honestly not sure.  Maybe tear it down and start over?  It's so complicated you have to train people how to use it.  It's finicky and buggy.  Your own customer service reps struggle with it.  If you do ONLY ONE THING, please fix the attachment issue.  Please please please. ",Training,Invoices,
Vendor Admin,"it would be nice to receive ""training"" on the SI7 to better understand what all it has to offer. Everything I know on the SI7 app is what I learned by trial and error.  very little training was offered to me when I came back to CBRE almost 4 years ago.  We have had one training day on Teams with Ms. Frenetta Tate.  I, along with several others of my team, have had little class training time on this app.  I probably could be doing something in an easier fashion if I only knew the system better.  I typically use my phone app to complete most of my work on SI7.  I'm not comfortable or understand SI7 enough to",training,,
Vendor Admin,"Maybe is lack of training, but there are certain tools that I'm still have difficult to use or understand.",training,IVR,
Site Manager,"More training. i have been LOST for months with this system, I am finally getting somewhere after I had training.",Training,WO,
Site Manager,more useful and relevant help links ,Training,Integration,
Site Manager,More video training ,training,WO,
Site Manager,Need better training ,Training,,
District Manager,Needs to be a bit more training. It's not very efficient to search for work orders when you have to restart search criteria every time you leave current list. It is also hard to give accurate start and completion times if the work order already comes in past due. Need to be able to edit completion times so vendors can receive more accurate score grades. ,Training,,
Site Manager,"Provide better training for CBRE/FM-Pilot users so that when an invoice or documentation is submitted, they understand what they are looking at so that less invoices are rejected for no reason thereby creating double work for vendor users.",Training,,
Vendor Admin,Provide user friendly instruction/guide for information needed/how to fill out a req. ,training,"Invoices, Quotes",
Vendor Admin,"SEVICE INSIGHT MAY BE ALOT BETTER THAN MY EXPERIENCES WITH IT, I BELEIVE  MY TRAINING WAS REALLY LACK LUSTER. SO MOST OF THIS SITE IS FORIEGN TO ME.  AND TRAINING, TRAINING, TRAINING. MAYBE SOME CLASSES ON TALENT COACH INSTEAD OF REPEATING THE SAME CLASSES EVERY YEAR",training,"Invoices, Reporting",
Vendor Admin,There was inadequate training.  There is little support available for questions.  The vendors chosen for HVAC issues have been awful.,Training,"WO, Notifications",
Vendor Admin,training on how to use and what is required by PM/PS using the porgram,Training,Attachments,
Site Manager,tutorials on functions!!!,Training,"WO, Commenting",
Vendor Admin,"WE need to get more training to our customer on how to submit work order through Service Insight. I am showing a lot of customer how to use it. Plus the one that are submitting work orders, they are over the spectra and I spend time to correct them, so we a get a true count on issues we are working on.",training,Quotes,
,As a new manager here at Cisco I am not up to date yet on all the processes used so I will need more time to make a sound judgement,"training, business process",WO,
Site Manager,Never had proper training on how to use it I've had to fumble through it on my own. Parts but I do not like once I look up a work order when I try to go back I got to re-submit everything for a particular building when I'm trying to do a site history,"training, data issue, Usability","WO, Notifications",
Site Manager,SI7 is difficult to navigate thru it does not use standard wildcard nor was it developed with the end user in mind the training provided is subpar at best and LOGCHECK is better!,"training, performance, Usability",WO,
Vendor Admin,I do not feel the CMMS Manager who reports to me receives an appropriate level of support from our ServiceInsight platform.  My primary concern is the manner in which ServiceInsight tickets are managed.  I would be happy to discuss this further with anyone who would be willing to hear that feedback.,"training, support",,
Site Manager,We have difficulties with support in Brazil. It would be interesting to generate online training for local teams and have a contact in Brazil for system support.,"training, support",,
Vendor Admin,"The Request Dashboard is a good service in submitting work to be completed, however if the Matrix is not setup properly this can lead to work orders going to companies that are not in my state. I would like to see the name of the company along side the Primary/Secondary matrix in the dispatching tool. Because this does not exist, I have to use the Main Portal to reassign the job to the correct vendor.","training, support, Usability",Invoices,
Site Manager,"I'm a new employee.  Like anything else, the more I use it, the easier it gets.  It was confusing at first, and I sometimes still get confused, but I'm beginning to understand it better and hope to be able to take better advantage of what it offers.","training, Usability","WO, Commenting",
Site Manager,"I'm still learning how to use the software, so I don't have much improvement comments other than the look and feel seems very outdated.","training, Usability",Attachments,
Vendor Admin,More user friendly. Easier to navigate. Some dummy proof directions.,"Training, Usability",,
Vendor Admin, make it easier to find all jobs at the same location to verify history. ,Usability,,
Facilities Manager, sometimes hard to find the correct category to select for certain workorders. ,Usability,WO,
Vendor Admin,"1 - easier search capabilities (more user-friendly), 2 -  eliminate (or at least edit) some of the questions that pop up on the dialog boxes that are poorly written, and really have no impact ",Usability,IVR,
Vendor Admin,2. the user interface is clunky and out dated ,Usability,,
Site Manager,4. ability to 'see' the asset list is too complex,Usability,WO,
Site Manager,a more modern interface,Usability,WO,
Site Manager,adjust the overall size and layout to be adjustable as you expand it.,Usability,"Attachments, WO",
Site Manager,Alerts when work orders are ready for payment. I only need to see my work orders not every station. Sometimes entries are problematic. ,Usability,,
Vendor Admin,Allow more time for your prompts during a check in / check out phone call. Our vendors almost never check into FMP2 because of the difficulty they experience trying to check in and check out of your IVR system.  ,Usability,,
Site Manager,"Also, when pulling a site history and opening one work order, I cannot easily go back and select the next item in the list (or preferred next item to view).  Thank you for requesting feedback!",Usability,,
Vendor Admin,An interface update would definitely be an improvement. As well as an easier way of tracking WO history.,Usability,,
Vendor Admin,Asset management isnt very user friendly for finding equipment or past work orders. ,Usability,"WO, Invoices",
Vendor Admin,"Attaching files/pictures is clunky and when I ask the CBRE person if they saw it they often say ""no"" - clunky for them as well?  ",Usability,"WO, Locations",
Site Manager,Better reports Easier navigation ,Usability,,
Vendor Admin,Biggest issue is there is no room for error. Typo an invoice number...to bad you'll need to type in another. ,Usability,,
Vendor Admin,Bulk invoicing is not user friendly at all,Usability,,
Vendor Admin,"Can we have an easy way to see a history of updates made to location data. To my knowledge it is currently impossible to see when the address of a location changed, and this can be important information to have. Related, can all providers in a location's matrix get an automatic email informing them of address changes?",Usability,,
Site Manager,"Can we make the website more use frendily, of creating a WO and attaching the file at the same time.",Usability,,
Site Manager,Clearer method to retrieve WO's accidentally/incorrectly closed.,Usability,,
Site Manager,"Commenting - having to send an email - is too difficult. Especially adding the appropriate people to the email.  Also, it would be great for it to open to WEB orders and have a separate tab for PM.",Usability,,
Site Manager,Commodi impedit off,Usability,,
Site Manager,Condense the job step process. Less steps to see closed work orders on mobile app and desktop app. ,Usability,Integration,
Site Manager,Constantly difficult access-I have to open and close it twice in order to get the correct facility.  The system asks for answers to be repeated and the drop downs are difficult to navigate.  ,Usability,Notifications,
Vendor Admin,Difficult to enter requests.  Too many steps. ,Usability,"Invoices, Notifications",
,"Difficult to enter requests.  Too many steps. Difficult to run all reports.  Parameter input is beyond difficult. If you want to print out a work order you have to turn it into a pdf first.  Too many steps. I have worked in several other Work Order/PM/Asset systems that are ""light years"" better than service insight.  I would not recommend to anyone.",Usability,,
Vendor Admin,Difficult to run all reports. ,Usability,,
Vendor Admin,easier display of screen vital info ,Usability,"Quotes, Invoices",
Site Manager,"easier invoice submission.  your current set up takes on average 3-4 mins from start to finish to submit an invoice with more than 5 lines.  Most of your invoices submitters have multiple accounts this is not good for efficiency. the ""upload"" system you offer is even clunkier and not user friendly let alone that you are only able to Submit at 10 and 4 and IF  there is enough room the system will pick up your batch submission.  ",Usability,WO,
Vendor Admin,"Easier layout, too cluttered with complicated menus.",Usability,,
Finance & Accounting,"Easy to use and enter what is needed, take the time out of having to call in the workorder.",Usability,Quotes,
Vendor Admin,"Either remove or improve the IVR check in process. All my techs have issues with it. Notify the person who created the work order when a comment is made so they can give an answer. I never receive replies to my comments. Come up with more a chat based program for customers and suppliers. Needs to be far more user friendly. Come up the an ""action required"" option on the work order tab. SO when answers are needed someone specific is notified. ",Usability,Quotes,
Customer Service Rep,Eliminate creating estimates and invoices in the portal. It is time consuming. We provide an estimate and invoice with the exact same information. ,Usability,,
Site Manager,Entering quotes & invoices is difficult at times because of how we operate with the client. This system was not built for companies like us. It would be nice also if you could be able to download multiple photos at one time and delete attachments if you upload something incorrect by mistake. ,Usability,WO,
Vendor Admin,"ES FACIL DE USAR, CONSIDERO DE MOMENTO ESTA SENCILLA. ",Usability,Reporting,
Vendor Admin,Filters to select WO's from different aspects don't work sometimes properly.,Usability,,
Site Manager,Fix the automatic log out which happens every 15 minutes,Usability,Commenting,
Site Manager,Fix the IVR so it is easier for techs to log in and out instead of telling you that you have made to many errors.  I have called the IVR to check a tech out lately because he was unable to do so and it kept telling me I made to many errors and hangs up.,Usability,WO,
Vendor Admin,FmPilot is by far the best interface among all we use for different clients,Usability,,
Site Manager,"fmPilot is extremely slow to navigate through, things expire before anything can be accessed or loaded, this is a frequent matter. ",Usability,,
Vendor Admin,FmPilot is pretty much a breeze.,Usability,,
Vendor Admin,FMPILOT works fine for us and easy to use. ,Usability,,
Vendor Admin,"For quotes, the description box once you enter a big paraph, it hard to navigate into the whole paraph.",Usability,IVR,
Vendor Admin,Give super users mpore access,Usability,Invoices,
Vendor Admin,"Going back to individual work orders for the week, it is too complex for our technicians to understand that there is only 1 work order for four separate weeks of services. The App never works and there is no way to search by site name on the app. Work orders disappear from our app and the website end as well. You cannot change the filter settings on the website as well after you have already saved one version.",Usability,"WO, Quotes",
Operations Manager,"Had little difficulty filling in the pop up page to describe the issue.  I missed one line and it erased the others when I finally figured out how to fill it in.  Finally the ""enter"" key popped up.... ",Usability,,
Vendor Admin,Having to reload the page constantly techs in the field have had troubles loading the page and accessing their WOs ,Usability,,
Vendor Admin,Honestly it is very simple and easy to use. ,Usability,"Quotes, Invoices",
Site Manager,"I believe the initial navigation of the application could be a little better. Many times I have top search classifications to find the right one to submit for repair. Example: Cleaning homeless debris on the property should not be classified as ""additional sweeping""",Usability,WO,
Site Manager,"I do struggle with the Problem Code. I work in a very large office, there are so many different things that goes wrong in the office and not many clear and precise code as to which to use. Sometimes it is a detailed issue like the numbering of the workstation/ desk is missing. In Si7 it will go under desk/furniture repairs. It is just a number that needs printing. There should be more sub-categories that is simple and relevant.",Usability,WO,
Vendor Admin,I feel that the main UI could really do with an uplift to look slicker and cleaner like the other CMMS competitors such as Maximo. ,Usability,Invoices,
Facilities Manager,"I FIND THAT THE PROCESS CAN BE DIFFICULT AT TIMES, NOT VERY USER FRIENDLY.",Usability,WO,
Account Coordinator,I had to create a work around to place a work order. The support is non existent.,Usability,Commenting,
Vendor Admin,"I hate that if you don't use the system within minutes, you have to resign in.",Usability,Invoices,
Vendor Admin,"I have to lo in and out several times before it puts my name and email address in boxes. I can enter them manually, but page won't advance to next page. FRUSTRATING!!!!!!!!!",Usability,"Invoices, WO",
Site Manager,"I like the description in newer layout like on the sally client. but the color of work orders is better in the older version Pending quote and PVINV should never have the same color. I would recommend using shades of color for work orders in the same category such as open and entirely different colors for each category like open, financial, completed... please place a copy button in the ribbon for work order number like there is when you go in the work order in the sallybeauty client and if there is a linked IFM work order please have that information viewable int the overview panel/i bubble header. also please include the work order number in the info strip for each comment. basically work order numbers everywhere, make it easy to find and know what work order a user is looking at, working in and commenting on, and if there is a linked provider or client work order associated with the current one. Plese note this does not include parent/daughter references. ",Usability,"WO, Notifications",
Vendor Admin,"I submit invoices to their respective PO's in fmPilot. However, some of the POs hide from me under different status's. Way too in depth - I want to open fmPilot and see all my work orders there - maybe a status to show accepted/paid by Savers Value Village, but otherwise I do not want to have to search for these WO's.",Usability,Attachments,
Site Manager,"I think SI7 is outdated i.e. the layout, the colours, etc. I would be grateful if the 'change category' box can be eliminated from popping up every time a request is opened.",Usability,"Locations, WO, Notifications",
Site Manager,"I think the usability must be easier. SI7 presents some troubles when we change languages, for example.",Usability,Commenting,
Facilities Manager,"I think there are too many steps to rise a ticket. it is small things each of them but taking time in total. for example, need to click ""start"", type and select my name after login to the system and need to type the request and completion both. need to click a dispatch..  Daily basic request, we do not have something particular to type comments, so I hope I can rise a ticket without key board, just using only mouse is better then.  ",Usability,Notifications,
Facilities Manager,I would improve that as well as reporting section for the specific sites. ,Usability,WO,
Site Manager,I'd like it to be easier to go between locations.  I have to click location dashboard to then be able to search another site.   I do that a lot more often than actually searching by a workorder number.  ,Usability,,
Vendor Admin,I'm still good with the interface but could have some improvements with the correct trade match from client-side to IFM to avoid rework.,Usability,Quotes,
Vendor Admin,If there was an option to open work orders in a new browser window when selecting them from a loaded site search screen that would be great.  The way it is now if I am looking for a specific work order if I click on one from the list and it's not the one I'm looking for every time I hit the back button I must rerun the site search.,Usability,Quotes,
Site Manager,IFM is the absolute worst IVR'n system Ive seen thus far. ,Usability,WO,
Site Manager,Improve ease of quote submittal.,Usability,"WO, Notifications",
Site Manager,Improve website interface. Less color/filter options. Simplify it. ,Usability,WO,
Site Manager,"Improved access availability, escalation of approvals, reduce number of clicks required to view backup information, improve wo status review and improve dashboarding.  Improve vendor onboarding and payment reconciliation. ",Usability,Locations,
,"In comparison to NVS's tool, SI7 is complicated, overpopulated with options (for office needs) and visually overcrowded. ",Usability,,
Facility Manager,It feels a bit busy...a little more white space would make it easier to read and work through.,Usability,,
Vendor Admin,"It is difficult to track work request.  It would be better with without the need for ""like"" or ""%"".",Usability,Admin,
Vendor Admin,it is difficult to use and confusing,Usability,,
Facility Manager,"It is easy to use once you get used to where everything is at.  The overall site appears a bit outdated, but its features have improved since we started using FM Pilot.    ",Usability,,
Vendor Admin,"it is not a user friendly portal. the layout, the buttons at the top, the changing status.  Corrigo is a much easy portal to use. Trying to quote in FM Pilot gives people stress. ",Usability,"Quotes, Attachments",
Facilities Manager,It is not user friendly and very hard to navigate even after using it for a year and a half. It adds a lot of extra work to my day.,Usability,,
Vendor Admin,"IT IS ONE OF THE EASIEST, MOST USER FRIENDLY FORMATS OUT THERE",Usability,"WO, Invoices, Attachments",
Site Manager,it is so cumbersome to add items to a quote.  make this a lot simpler.,Usability,,
Customer Service Rep,It is sometimes very restrictive.  It would be very helpful if we could invoice for the current job and quote for future work separately.  ,Usability,"WO, Quotes",
Vendor Admin,IT IS TOO EASY TO MAKE MISTAKES WITH HOW FINICKY THIS PORTAL IS. ,Usability,Invoices,
Facility Manager,It is too hard to check the status of a work order. The issuer/customer cannot make comments on the work order. ,Usability,,
Vendor Admin,"It make my job more easier to know were to go, when we are confronting problems with anything that needs fixing that needs repair right away for our unit. ",Usability,IVR,
Vendor Admin,It needs to be more user friendly,Usability,Attachments,
Site Manager,"It needs to be more user friendly for users with more than one location. Maybe an option for the calendar to have location added so we can view only WO's for that location, or have the WO numbers showing on the dates without having to click on them to open them. All vendors need to update WO's quicker. ",Usability,,
Operations Manager,It shouldn't take 22 steps to create a work order.,Usability,WO,
Site Manager,It times out to quickly; lately there has been a lot of issues with the IVR and techs can't check in/out.  Overall it isn't user friendly. ,Usability,WO,
Customer Service Rep,"it used to default to my location. if im not paying attention, i have added work orders for other locations in error. ",Usability,,
Vendor Admin,It would be awesome if when creating a work order if it could be completed on one screen.  When I have to create a work order with a quote there are too many steps involved.  It seems that every time that you navigate from one screen to the next you have to wait.,Usability,Invoices,
Vendor Admin,it would be great to get an app for the phone that works as good as the computer version. thanks Myron,Usability,"Quotes, Invoices",
System Administrator,It would be nice if we could get better/easier communication in the portal.,Usability,"assets, PM",Negative
Facility Manager,It would be nice to add comments to work orders without having to know someone's email address. ,Usability,languages,Negative
System Administrator,it's just difficult finding things on the site,Usability,"assets, search",Negative
Facility Manager,"It's not possible to move a quote that includes labor to the invoice screen without rekeying. Would be great to have all of that flow through.  Also have issues with labor rates not being preloaded and when that occurs, we are unable to use the Labor line item in invoicing b/c we can't override the labor rate to fix the issue.   ",Usability,JDE,Negative
Facility Manager,It's very hard to create a proposal and searching for work orders. ,Usability,"portal, WO, search",Negative
Client/Customer,Its as easy as it gets,Usability,Attachments,Negative
Facility Manager,its very easy to use,Usability,"WO, Request",Neutral
Facility Manager,keep the app working better and it is much easier than desktop version,Usability,"WO, printing/pdf",Negative
System Administrator,"less clicks and menues to create a work order,  not default to location that I am not at, send push emails on status and when work orders are complete.  Too time consuming to schedule a work order and follow up on the status of it.",Usability,job plans,Negative
Facility Manager,Less questions,Usability,vendor,Negative
System Administrator,looks like a website from 2002. needs to make updated status more streamlined as well as adding attachments and updating. ,Usability,"Attachments, PO",Negative
Facility Manager,Make a much more user friendly UI. Having sections and bulkier buttons instead of text to click on would be so much more appealing.,Usability,"SIRequest, client",Negative
Facility Manager,"make is easier to put invoices in, be able to log in from the workorder online",Usability,WO,Negative
Client/Customer,Make it easier to attach attachments to a work order/request,Usability,"notification, email",Negative
Technician,make it easier to find where to invoice ...under finance tab is not as easy to remember when not using portal that often ,Usability,WO,Negative
Client/Customer,Make it easier to locate just your station. The widgets are not done well and if I dont know the WEB number it takes a while. I should not have to filter through other stations items. ,Usability,"login, mobile, Desktop, client",Negative
Technician,Make it easier to locate work orders and share visibility between work teams,Usability,WO,Negative
Technician,"Make it easier to search jobs, enter correct completion date and time, space out PM's, and the app isn't very user friendly. ",Usability,"PM, WO, Attachments, Request",Negative
Technician,make it easier to submit quotes like service channel or maximo ,Usability,"mobile, login",Negative
Facility Manager,make it easier to upload items and not have to resave everything ,Usability,"client, WO, navigation",Negative
Facility Coordinator,"Make it facility specific when logging into the app vs the entire division/village's WOs listed.  It's time consuming filtering away the unnecessary details of other facilities work orders to find your own WOs.  Also, do not CLOSE a work order until the entire order is complete, ie. I placed a facility refresh request into the system in 2022 for the 2023 Refresh project and it was closed and nothing has been completed in the WO.",Usability,"PO, vendor, client, mobile",Negative
Customer Service Rep,Make it more intuitive to use,Usability,NTE,Negative
Facility Manager,Make it more user friendly.,Usability,Reporting,Negative
Facility Manager,Make it MUCH easier to use!!!!!!!!!!!!!!!!!!,Usability,"WO, search, locations",Neutral
Technician,Make it user friendly,Usability,"WO, assets",Negative
Technician,make more user friendly,Usability,"WO, assets",Negative
Facility Manager,"Make searching work orders easier, showing current work orders that are open without the need in filtering it to show it.",Usability,iMFM,Negative
Customer Service Rep,Make the reporting features easier to navigate to generate the needed reports,Usability,"Desktop, client",Neutral
System Administrator,"Make the UX more friendly, and clearer.",Usability,,Negative
Facility Manager,Make updating password be a little easier to obtain,Usability,"WO, search",Negative
